Sheet: 合成级配
P1: 第2页，共7页
A2: 矿料合成级配试验检测报告 | P2: XMBCBGLSW001 BGLQ09006F
A3: 检测单位名称：厦门百川建设工程检测有限公司 | K3: 报告编号：
A4: 工程部位/用途 | K4: 委托/任务编号 | N4: ${reportVo.order.clientUnit!"---"}
A5: 试验依据 | K5: 样品编号
A6: 样品描述 | K6: 试验日期 | X6: 26.5 | Y6: 19 | Z6: 16 | AA6: 13.2 | AB6: 9.5 | AC6: 4.75 | AD6: 2.36 | AE6: 1.18 | AF6: 0.6 | AG6: 0.3 | AH6: 0.15 | AI6: 7.4999999999999997E-2
A7: 矿料组成比例 | U7: 15~25 | X7: 80 | Y7: 26.6 | Z7: 5.2 | AA7: 1.4 | AB7: 0.75 | AC7: 0.4 | AD7: 0.4 | AE7: 0.4 | AF7: 0.4 | AG7: 0.4 | AH7: 0.2 | AI7: 0.2
A8: 集料名称 | D8: （15-25）mm碎石 | H8: （10-20）mm碎石 | L8: （5-10）mm碎石 | P8: （0-5）mm石屑 | U8: 10~20 | X8: 100 | Y8: 83.9 | Z8: 55.4 | AA8: 37.1 | AB8: 15.25 | AC8: 0.6 | AD8: 0.5 | AE8: 0.5 | AF8: 0.5 | AG8: 0.5 | AH8: 0.4 | AI8: 0.2
A9: 比例 | U9: 5~10 | X9: 100 | Y9: 100 | Z9: 100 | AA9: 100 | AB9: 95.9 | AC9: 15.1 | AD9: 1.9 | AE9: 1.4 | AF9: 1.1000000000000001 | AG9: 0.9 | AH9: 0.7 | AI9: 0.5
A10: 矿料合成级配 | U10: 0~5 | X10: 100 | Y10: 100 | Z10: 100 | AA10: 100 | AB10: 100 | AC10: 92.4 | AD10: 68 | AE10: 51.2 | AF10: 37.6 | AG10: 22 | AH10: 17.2 | AI10: 9.5
A11: 通过下列筛孔（mm）的百分率（%） | U11: 级配 | W11: 比例
A12: 筛孔（mm） | F12: 31.5 | G12: 26.5 | H12: 19 | I12: 16 | J12: 13.2 | K12: 9.5 | L12: 4.75 | M12: 2.36 | N12: 1.18 | O12: 0.6 | P12: 0.3 | Q12: 0.15 | R12: 7.4999999999999997E-2 | U12: 15~25 | W12: 20 | X12: =R[-5]C*R12C23/100 -> 16 | Y12: =ROUND(R[-5]C*R12C23/100,1) -> 5.3 | Z12: =ROUND(R[-5]C*R12C23/100,1) -> 1 | AA12: =ROUND(R[-5]C*R12C23/100,1) -> 0.3 | AB12: =ROUND(R[-5]C*R12C23/100,1) -> 0.2 | AC12: =ROUND(R[-5]C*R12C23/100,1) -> 0.1 | AD12: =ROUND(R[-5]C*R12C23/100,1) -> 0.1 | AE12: =ROUND(R[-5]C*R12C23/100,1) -> 0.1 | AF12: =ROUND(R[-5]C*R12C23/100,1) -> 0.1 | AG12: =ROUND(R[-5]C*R12C23/100,1) -> 0.1 | AH12: =ROUND(R[-5]C*R12C23/100,1) -> 0 | AI12: =ROUND(R[-5]C*R12C23/100,1) -> 0
A13: 合成级配 | U13: 10~20 | W13: 30 | X13: =R[-5]C*R13C23/100 -> 30 | Y13: =ROUND(R[-5]C*R13C23/100,1) -> 25.2 | Z13: =ROUND(R[-5]C*R13C23/100,1) -> 16.600000000000001 | AA13: =ROUND(R[-5]C*R13C23/100,1) -> 11.1 | AB13: =ROUND(R[-5]C*R13C23/100,1) -> 4.5999999999999996 | AC13: =ROUND(R[-5]C*R13C23/100,1) -> 0.2 | AD13: =ROUND(R[-5]C*R13C23/100,1) -> 0.2 | AE13: =ROUND(R[-5]C*R13C23/100,1) -> 0.2 | AF13: =ROUND(R[-5]C*R13C23/100,1) -> 0.2 | AG13: =ROUND(R[-5]C*R13C23/100,1) -> 0.2 | AH13: =ROUND(R[-5]C*R13C23/100,1) -> 0.1 | AI13: =ROUND(R[-5]C*R13C23/100,1) -> 0.1
A14: 级配中值 | F14: 100 | G14: / | H14: 77 | I14: / | J14: / | K14: 48 | L14: 27 | M14: 22 | N14: / | O14: 11.5 | P14: / | Q14: / | R14: 1.5 | U14: 5~10 | W14: 25 | X14: =R[-5]C*R14C23/100 -> 25 | Y14: =R[-5]C*R14C23/100 -> 25 | Z14: =R[-5]C*R14C23/100 -> 25 | AA14: =R[-5]C*R14C23/100 -> 25 | AB14: =ROUND(R[-5]C*R14C23/100,1) -> 24 | AC14: =ROUND(R[-5]C*R14C23/100,1) -> 3.8 | AD14: =ROUND(R[-5]C*R14C23/100,1) -> 0.5 | AE14: =ROUND(R[-5]C*R14C23/100,1) -> 0.4 | AF14: =ROUND(R[-5]C*R14C23/100,1) -> 0.3 | AG14: =ROUND(R[-5]C*R14C23/100,1) -> 0.2 | AH14: =ROUND(R[-5]C*R14C23/100,1) -> 0.2 | AI14: =ROUND(R[-5]C*R14C23/100,1) -> 0.1
A15: 级配上限 | F15: 100 | G15: / | H15: 86 | I15: / | J15: / | K15: 58 | L15: 32 | M15: 28 | N15: / | O15: 15 | P15: / | Q15: / | R15: 3 | U15: 0~5 | W15: 25 | X15: =R[-5]C*R15C23/100 -> 25 | Y15: =R[-5]C*R15C23/100 -> 25 | Z15: =R[-5]C*R15C23/100 -> 25 | AA15: =R[-5]C*R15C23/100 -> 25 | AB15: =R[-5]C*R15C23/100 -> 25 | AC15: =ROUND(R[-5]C*R15C23/100,1) -> 23.1 | AD15: =ROUND(R[-5]C*R15C23/100,1) -> 17 | AE15: =ROUND(R[-5]C*R15C23/100,1) -> 12.8 | AF15: =ROUND(R[-5]C*R15C23/100,1) -> 9.4 | AG15: =ROUND(R[-5]C*R15C23/100,1) -> 5.5 | AH15: =ROUND(R[-5]C*R15C23/100,1) -> 4.3 | AI15: =ROUND(R[-5]C*R15C23/100,1) -> 2.4
A16: 级配下限 | F16: 100 | G16: / | H16: 68 | I16: / | J16: / | K16: 38 | L16: 22 | M16: 16 | N16: / | O16: 8 | P16: / | Q16: / | R16: 0 | U16: 合成 | X16: =SUM(R[-4]C:R[-1]C) -> 96 | Y16: =SUM(R[-4]C:R[-1]C) -> 80.5 | Z16: =SUM(R[-4]C:R[-1]C) -> 67.599999999999994 | AA16: =SUM(R[-4]C:R[-1]C) -> 61.4 | AB16: =SUM(R[-4]C:R[-1]C) -> 53.8 | AC16: =SUM(R[-4]C:R[-1]C) -> 27.2 | AD16: =SUM(R[-4]C:R[-1]C) -> 17.8 | AE16: =SUM(R[-4]C:R[-1]C) -> 13.5 | AF16: =SUM(R[-4]C:R[-1]C) -> 10 | AG16: =SUM(R[-4]C:R[-1]C) -> 6 | AH16: =SUM(R[-4]C:R[-1]C) -> 4.5999999999999996 | AI16: =SUM(R[-4]C:R[-1]C) -> 2.6
W17: =SUM(R[-5]C:R[-2]C) -> 100
Y19: 9
Y20: =R[-1]C/2 -> 4.5
Y21: 筛孔（mm） | Z21: 31.5 | AA21: 19 | AB21: 9.5 | AC21: 4.75 | AD21: 2.36 | AE21: 0.6 | AF21: 7.4999999999999997E-2
Y22: 合成级配 | Z22: 100 | AA22: 80.5 | AB22: 53.8 | AC22: 27.2 | AD22: 17.8 | AE22: 10 | AF22: 2.6
Y23: 级配中值 | Z23: =AVERAGE(R[1]C:R[2]C) -> 100 | AA23: =AVERAGE(R[1]C:R[2]C) -> 77 | AB23: =AVERAGE(R[1]C:R[2]C) -> 48 | AC23: =AVERAGE(R[1]C:R[2]C) -> 27 | AD23: =AVERAGE(R[1]C:R[2]C) -> 22 | AE23: =AVERAGE(R[1]C:R[2]C) -> 11.5 | AF23: =AVERAGE(R[1]C:R[2]C) -> 1.5
Y24: 级配上限 | Z24: 100 | AA24: 86 | AB24: 58 | AC24: 32 | AD24: 28 | AE24: 15 | AF24: 3
Y25: 级配下限 | Z25: 100 | AA25: 68 | AB25: 38 | AC25: 22 | AD25: 16 | AE25: 8 | AF25: 0
Z28: =R[-7]C^0.45 -> 4.7232371227987304 | AA28: =R[-7]C^0.45 -> 3.7621761023863001 | AB28: =R[-7]C^0.45 -> 2.7540741085661198 | AC28: =R[-7]C^0.45 -> 2.01610025396293 | AD28: =R[-7]C^0.45 -> 1.47166987958204 | AE28: =R[-7]C^0.45 -> 0.79463568224020398 | AF28: =R[-7]C^0.45 -> 0.31172925995349998
A30: 检测结论：
A31: 备注： | Y31: X | Z31: Y
A32: 试验： 审核： 签发： 日期： 年 月 日 | X32: 31.5 | Y32: =R[-4]C[1] -> 4.7232371227987304 | Z32: 100
Y33: =R[-5]C[1] -> 4.7232371227987304 | Z33: 0
X35: 26.5 | Y35: =R[2]C[-18] -> 4.3697907726382104 | Z35: 100
Y36: =R[-1]C -> 4.3697907726382104 | Z36: 0
E37: X轴辅线 | G37: =R[-25]C^0.45 -> 4.3697907726382104 | H37: =R[-25]C^0.45 -> 3.7621761023863001 | I37: =R[-25]C^0.45 -> 3.4822022531845001 | J37: =R[-25]C^0.45 -> 3.1934363838687401 | K37: =R[-25]C^0.45 -> 2.7540741085661198 | L37: =R[-25]C^0.45 -> 2.01610025396293 | M37: =R[-25]C^0.45 -> 1.47166987958204 | N37: =R[-25]C^0.45 -> 1.07732540992504 | O37: =R[-25]C^0.45 -> 0.79463568224020398 | P37: =R[-25]C^0.45 -> 0.58170736792793798 | Q37: =R[-25]C^0.45 -> 0.42583471830473701 | R37: =R[-25]C^0.45 -> 0.31172925995349998
X38: 19 | Y38: =R[-1]C[-17] -> 3.7621761023863001 | Z38: 100
J39: =R[-2]C[-3]-R[-2]C[8] -> 4.0580615126847102 | Y39: =R[-1]C -> 3.7621761023863001 | Z39: 0
X41: 16 | Y41: =R[-4]C[-16] -> 3.4822022531845001 | Z41: 100
Y42: =R[-1]C -> 3.4822022531845001 | Z42: 0
X43: 13.2 | Y43: =R[-6]C[-15] -> 3.1934363838687401 | Z43: 100
Y44: =R[-1]C -> 3.1934363838687401 | Z44: 0
X45: 9.5 | Y45: =R[-8]C[-14] -> 2.7540741085661198 | Z45: 100
Y46: =R[-1]C -> 2.7540741085661198 | Z46: 0
X47: 4.7 | Y47: =R[-10]C[-13] -> 2.01610025396293 | Z47: 100
Y48: =R[-1]C -> 2.01610025396293 | Z48: 0
X49: 2.36 | Y49: =R[-12]C[-12] -> 1.47166987958204 | Z49: 100
Y50: =R[-1]C -> 1.47166987958204 | Z50: 0
X51: 1.18 | Y51: =R[-14]C[-11] -> 1.07732540992504 | Z51: 100
Y52: =R[-1]C -> 1.07732540992504 | Z52: 0
X53: 0.6 | Y53: =R[-16]C[-10] -> 0.79463568224020398 | Z53: 100
Y54: =R[-1]C -> 0.79463568224020398 | Z54: 0
X55: 0.3 | Y55: =R[-18]C[-9] -> 0.58170736792793798 | Z55: 100
Y56: =R[-1]C -> 0.58170736792793798 | Z56: 0
X57: 0.15 | Y57: =R[-20]C[-8] -> 0.42583471830473701 | Z57: 100
Y58: =R[-1]C -> 0.42583471830473701 | Z58: 0
X59: 7.4999999999999997E-2 | Y59: =R[-22]C[-7] -> 0.31172925995349998 | Z59: 100
Y60: =R[-1]C -> 0.31172925995349998 | Z60: 0