Sheet: 报告1
Q1: 第 1 页，共 2 页
A2: 沥青混合料中沥青含量试验（燃烧炉法） | R2: XMBCBGLLQ011
A3: 沥青用量及筛分级配修正系数确定试验检测报告 | R3: BGLQ11008F | Y3: JB010911
A5: 检测单位名称：厦门百川建设工程检测有限公司 报告编号： | N5: 报告编号：
A6: 委托单位 | M6: 委托编号
A7: 建设单位 | M7: 样品编号
A8: 工程名称 | M8: 委托日期
A9: 施工单位 | M9: 检测日期
A10: 见证单位 | M10: 报告日期
A11: 见证人/ 见证人编号 | M11: 取样员/取样员编号
A12: 工程部位/用途 | M12: 样品数量
A13: 样品描述 | M13: 代表数量
A14: 检测依据 | M14: 联系人/联系方式
A15: 判定依据 | M15: 样品性状
A16: 主要仪器设备 | C16: 管理编号 | E16: 仪器名称 | I16: 有效期至 | L16: 管理编号 | N16: 仪器名称 | R16: 有效期至
A19: ATB-25生产配合比及试样组成
A20: 材料 名称 | B20: 1#仓 (20-30)mm | D20: 2#仓 (15-20)mm | F20: 3#仓 (10-15)mm | H20: 4#仓 (5-10)mm | J20: 5#仓 (0-5)mm | L20: 矿粉 | N20: 油石比 | P20: 沥青用量 | R20: 合计
A21: 比例,%
A22: 试样1/ 试样2 用量,g
A23: 试样3 (洗锅料) 用量,g
A24: 试样4/ 试样5 用量,g
A25: 燃烧前集料混合料筛分级配试验记录（水洗法） | U25: 水洗前质量 | V25: 试样1 | W25: 试样2
A26: 干燥试样总质量,g | H26: 试样1 | M26: 试样2 | U26: -- | V26: =R[-4]C[-4] -> 0 | W26: =R[-4]C[-5] -> 0
A28: 水洗后矿料总质量,g
A29: 孔径,mm | B29: 分计筛余,g | F29: 分计筛余,% | J29: 累计筛余,% | N29: 通过率,% | R29: 平均值,%
B30: 1 | D30: 2 | F30: 1 | H30: 2 | J30: 1 | L30: 2 | N30: 1 | P30: 2 | U30: 生产级配
A31: 31.5 | U31: 100 | V31: 0 | W31: 0
A32: 26.5 | U32: 95.341999999999999 | V32: =R26C22*RC[-16]/100-RAND()*(0.3) -> -0.25215001759566941 | W32: =R26C22*RC[-15]/100-RAND()*(0.3) -> -0.22443637090492546 | Y32: =ROUND(RC[-3],1) -> -0.3 | Z32: =ROUND(RC[-3],1) -> -0.2
A33: 19 | U33: 71.355000000000004 | V33: =R26C22*RC[-16]/100-RAND()*(0.3) -> -0.20007540134762214 | W33: =R26C22*RC[-15]/100-RAND()*(0.3) -> -0.1865674268734939 | Y33: =ROUND(RC[-3],1) -> -0.2 | Z33: =ROUND(RC[-3],1) -> -0.2
A34: 16 | U34: 60.417999999999999 | V34: =R26C22*RC[-16]/100-RAND()*(0.3) -> -3.8705483082211299E-2 | W34: =R26C22*RC[-15]/100-RAND()*(0.3) -> -0.10052676569780672 | Y34: =ROUND(RC[-3],1) -> 0 | Z34: =ROUND(RC[-3],1) -> -0.1
A35: 13.2 | U35: 51.578000000000003 | V35: =R26C22*RC[-16]/100-RAND()*(0.3) -> -0.19529021985617492 | W35: =R26C22*RC[-15]/100-RAND()*(0.3) -> -0.29055276124115609 | Y35: =ROUND(RC[-3],1) -> -0.2 | Z35: =ROUND(RC[-3],1) -> -0.3
A36: 9.5 | U36: 43.933 | V36: =R26C22*RC[-16]/100-RAND()*(0.3) -> -6.0561956553382729E-2 | W36: =R26C22*RC[-15]/100-RAND()*(0.3) -> -7.9325646571251587E-2 | Y36: =ROUND(RC[-3],1) -> -0.1 | Z36: =ROUND(RC[-3],1) -> -0.1
A37: 4.75 | U37: 33.774999999999999 | V37: =R26C22*RC[-16]/100-RAND()*(0.3) -> -0.20909941091694781 | W37: =R26C22*RC[-15]/100-RAND()*(0.3) -> -4.034892334955182E-2 | Y37: =ROUND(RC[-3],1) -> -0.2 | Z37: =ROUND(RC[-3],1) -> 0
A38: 2.36 | U38: 21.535 | V38: =R26C22*RC[-16]/100-RAND()*(0.3) -> -0.26079479388560645 | W38: =R26C22*RC[-15]/100-RAND()*(0.3) -> -0.22676745810225493 | Y38: =ROUND(RC[-3],1) -> -0.3 | Z38: =ROUND(RC[-3],1) -> -0.2
A39: 1.18 | U39: 15.773 | V39: =R26C22*RC[-16]/100-RAND()*(0.3) -> -0.16268920176334359 | W39: =R26C22*RC[-15]/100-RAND()*(0.3) -> -0.24701338973936782 | Y39: =ROUND(RC[-3],1) -> -0.2 | Z39: =ROUND(RC[-3],1) -> -0.2
A40: 0.6 | U40: 12.113 | V40: =R26C22*RC[-16]/100-RAND()*(0.3) -> -0.21398556778076352 | W40: =R26C22*RC[-15]/100-RAND()*(0.3) -> -0.18367569234234007 | Y40: =ROUND(RC[-3],1) -> -0.2 | Z40: =ROUND(RC[-3],1) -> -0.2
A41: 0.3 | U41: 9.173 | V41: =R26C22*RC[-16]/100-RAND()*(0.3) -> -0.29617328067775578 | W41: =R26C22*RC[-15]/100-RAND()*(0.3) -> -0.2030704452647982 | Y41: =ROUND(RC[-3],1) -> -0.3 | Z41: =ROUND(RC[-3],1) -> -0.2
A42: 0.15 | U42: 5.3239999999999998 | V42: =R26C22*RC[-16]/100-RAND()*(0.3) -> -0.14379578626870407 | W42: =R26C22*RC[-15]/100-RAND()*(0.3) -> -0.25234920789078924 | Y42: =ROUND(RC[-3],1) -> -0.1 | Z42: =ROUND(RC[-3],1) -> -0.3
A43: 7.4999999999999997E-2 | U43: 3.0790000000000002 | V43: =R26C22*RC[-16]/100-RAND()*(0.3) -> -0.28923618632723175 | W43: =R26C22*RC[-15]/100-RAND()*(0.3) -> -1.7399496157331596E-2 | Y43: =ROUND(RC[-3],1) -> -0.3 | Z43: =ROUND(RC[-3],1) -> 0
A44: 筛底(g)
A45: 干筛后总量∑mi(g)
A46: 损耗(g)
A47: 损耗率（%）
A48: 结论
A49: 备注
A50: 声 明 | B50: 1.本报告（含完整复制件）未加盖“检验检测专用章”无效； 2.报告签名不全无效，改动、换页无效； 3.未经本公司书面批准，不得复制（全文复制除外）该试验检测报告； 4.对于非本公司负责抽样的情况，本公司的检测结果仅适用于客户提供的样品； 5.若对本报告有异议，请于收到之日起15日内向本公司提出书面复议申请，逾期不予受理。 | M50: 联系方式 | N50: 地址：厦门市集美区同集南路369~371号 邮编：361021 传真：0592-6362187 电话：0592-6362187
A52: 检测： 审核： 批准： 日期： 年 月 日

Sheet: 报告2
A1: 第 2 页，共 2 页
A2: 沥青混合料中沥青含量试验（燃烧炉法） | R2: XMBCBGLLQ011 | Y2: JB010911
A3: 沥青用量及筛分级配修正系数确定试验检测报告 | S3: BGLQ11008F
A5: 检测单位名称：厦门百川建设工程检测有限公司 报告编号：
A6: 委托单位 | E6: ${reportVo.order.clientUnit!"---"} | M6: 委托编号 | Q6: ${reportVo.order.code!"---"}
A7: 建设单位 | E7: ${reportVo.project.constructUnit!"---"} | M7: 样品编号
A8: 工程名称 | E8: ${reportVo.project.name!"---"} | M8: 委托日期 | Q8: ${reportVo.order.orderDate?string('yyyy-MM-dd')}
A9: 施工单位 | E9: ${reportVo.project.workingUnit!"---"} | M9: 检测日期
A10: 见证单位 | E10: ${reportVo.order.witnessUnit!"---"} | M10: 报告日期
A11: 见证人/ 见证人编号 | E11: ${reportVo.order.witnessPersonName!"---"}/${reportVo.order.witnessPersonCode!"---"} | M11: 取样员/取样员编号 | Q11: ${reportVo.order.samplingPersonName!"---"}/${reportVo.order.samplingPersonCode!"---"}
A12: 工程部位/用途 | M12: 样品数量
A13: 样品描述 | M13: 代表数量
A14: 检测依据 | M14: 联系人/联系方式
A15: 判定依据 | M15: 样品性状
A16: 主要仪器设备 | C16: 管理编号 | E16: 仪器名称 | I16: 有效期至 | L16: 管理编号 | N16: 仪器名称 | R16: 有效期至
A18: 沥青混合料沥青用量修正系数
A19: 试样 编号 | B19: 燃烧前沥青混合料 质量,g | F19: 燃烧后矿料混合料 质量,g | I19: 损失率,% | K19: 平均损失率,% | N19: 标准沥青用量,% | Q19: 修正系数,%
A20: 试样4
A21: 试样5
A22: 燃烧后矿料混合料筛分级配试验记录（水洗法）
A23: 燃烧后矿料混合料总质量,g | H23: 试样4 | N23: 试样5 | U23: 试样3 | W23: 试样4
H24: =R[-4]C[-2] -> 0 | N24: =R[-3]C[-8] -> 0
A25: 水洗后矿料总质量,g | H25: =RC[13]-RC[13]*R[15]C[6]/100 -> 0 | N25: =RC[9]-RC[9]*R[15]C[2]/100 -> 0 | U25: =R[-1]C[-13] -> 0 | W25: =R[-1]C[-9] -> 0
A26: 孔径,mm | B26: 分计筛余,g | F26: 分计筛余,% | J26: 累计筛余,% | N26: 通过率,% | R26: 平均值,%
B27: 3 | D27: 4 | F27: 3 | H27: 4 | J27: 3 | L27: 4 | N27: 3 | P27: 4
A28: 31.5
A29: 26.5 | U29: =R45C21*RC[-15]/100-RAND()*0.3 -> -9.2772412647911487E-2 | W29: =R45C23*RC[-15]/100-RAND()*0.3 -> -0.16147801026824934 | Z29: =ROUND(RC[-5],1) -> -0.1 | AA29: =ROUND(RC[-4],1) -> -0.2
A30: 19 | U30: =R45C21*RC[-15]/100-RAND()*0.3 -> -0.22236160872359814 | W30: =R45C23*RC[-15]/100-RAND()*0.3 -> -7.9812041642621193E-2 | Z30: =ROUND(RC[-5],1) -> -0.2 | AA30: =ROUND(RC[-4],1) -> -0.1
A31: 16 | U31: =R45C21*RC[-15]/100-RAND()*0.3 -> -0.17794253122108541 | W31: =R45C23*RC[-15]/100-RAND()*0.3 -> -1.6077744477481105E-2 | Z31: =ROUND(RC[-5],1) -> -0.2 | AA31: =ROUND(RC[-4],1) -> 0
A32: 13.2 | U32: =R45C21*RC[-15]/100-RAND()*0.3 -> -0.15547724439208654 | W32: =R45C23*RC[-15]/100-RAND()*0.3 -> -0.28188756060487236 | Z32: =ROUND(RC[-5],1) -> -0.2 | AA32: =ROUND(RC[-4],1) -> -0.3
A33: 9.5 | U33: =R45C21*RC[-15]/100-RAND()*0.3 -> -0.17290948787715402 | W33: =R45C23*RC[-15]/100-RAND()*0.3 -> -0.25934339418717917 | Z33: =ROUND(RC[-5],1) -> -0.2 | AA33: =ROUND(RC[-4],1) -> -0.3
A34: 4.75 | U34: =R45C21*RC[-15]/100-RAND()*0.3 -> -0.1714480203591249 | W34: =R45C23*RC[-15]/100-RAND()*0.3 -> -0.15251455264564082 | Z34: =ROUND(RC[-5],1) -> -0.2 | AA34: =ROUND(RC[-4],1) -> -0.2
A35: 2.36 | U35: =R45C21*RC[-15]/100-RAND()*0.3 -> -0.24960000915551728 | W35: =R45C23*RC[-15]/100-RAND()*0.3 -> -0.18245807757390622 | Z35: =ROUND(RC[-5],1) -> -0.2 | AA35: =ROUND(RC[-4],1) -> -0.2
A36: 1.18 | U36: =R45C21*RC[-15]/100-RAND()*0.3 -> -0.13775721847895481 | W36: =R45C23*RC[-15]/100-RAND()*0.3 -> -5.4018451546468949E-2 | Z36: =ROUND(RC[-5],1) -> -0.1 | AA36: =ROUND(RC[-4],1) -> -0.1
A37: 0.6 | U37: =R45C21*RC[-15]/100-RAND()*0.3 -> -0.19969998248198317 | W37: =R45C23*RC[-15]/100-RAND()*0.3 -> -9.3156337976690901E-2 | Z37: =ROUND(RC[-5],1) -> -0.2 | AA37: =ROUND(RC[-4],1) -> -0.1
A38: 0.3 | U38: =R45C21*RC[-15]/100-RAND()*0.3 -> -0.26939237414044076 | W38: =R45C23*RC[-15]/100-RAND()*0.3 -> -8.2214411370765877E-2 | Z38: =ROUND(RC[-5],1) -> -0.3 | AA38: =ROUND(RC[-4],1) -> -0.1
A39: 0.15 | U39: =R45C21*RC[-15]/100-RAND()*0.3 -> -0.24314659828714513 | W39: =R45C23*RC[-15]/100-RAND()*0.3 -> -7.4887337387679123E-2 | Z39: =ROUND(RC[-5],1) -> -0.2 | AA39: =ROUND(RC[-4],1) -> -0.1
A40: 7.4999999999999997E-2 | U40: =R45C21*RC[-15]/100-RAND()*0.3 -> -0.16973424311467603 | W40: =R45C23*RC[-15]/100-RAND()*0.3 -> -0.18149971560200956 | Z40: =ROUND(RC[-5],1) -> -0.2 | AA40: =ROUND(RC[-4],1) -> -0.2
A41: 筛底(g)
A42: 干筛后总量∑mi(g)
A43: 损耗(g)
A44: 损耗率（%）
A45: 沥青混合料筛分级配修正系数
A46: 孔径mm | G46: 31.5 | H46: 26.5 | I46: 19 | J46: 16 | K46: 13.2 | L46: 9.5 | M46: 4.75 | N46: 2.36 | O46: 1.18 | P46: 0.6 | Q46: 0.3 | R46: 0.15 | S46: 7.4999999999999997E-2
A47: 燃烧前、后级配偏差,%
A48: 允许偏差,% | G48: ±5 | H48: ±5 | I48: ±5 | J48: ±5 | K48: ±5 | L48: ±5 | M48: ±5 | N48: ±5 | O48: ±3 | P48: ±3 | Q48: ±3 | R48: ±3 | S48: ±0.5
A49: 修正系数,% | G49: 0 | H49: 0 | I49: 0 | J49: 0 | K49: 0 | L49: 0 | M49: 0 | N49: 0 | O49: 0 | P49: 0 | Q49: 0 | R49: 0 | S49: 0
A50: 检测结论：该ATB-25沥青混合料沥青用量修正系数为-0.12%，筛分级配修正系数见上表。
A51: 备注
A52: 声 明 | B52: 1.本报告（含完整复制件）未加盖“检验检测专用章”无效； 2.报告签名不全无效，改动、换页无效； 3.未经本公司书面批准，不得复制（全文复制除外）该试验检测报告； 4.对于非本公司负责抽样的情况，本公司的检测结果仅适用于客户提供的样品； 5.若对本报告有异议，请于收到之日起15日内向本公司提出书面复议申请，逾期不予受理。 | M52: 联系方式 | N52: 地址：厦门市集美区同集南路369~371号 邮编：361021 传真：0592-6362187 电话：0592-6362187
A54: 检测： 审核： 批准： 日期： 年 月 日